{
  "version": 2,
  "library": "cmocean",
  "width": 256,
  "rows": 12,
  "colormaps": [
    {
      "name": "thermal",
      "source": "cmocean",
      "source_id": "thermal",
      "type": "sequential",
      "perceptually_uniform": true,
      "description": "Heat-like; deep blue→bright yellow. Good for energy / activity magnitude.",
      "citation": "Thyng et al. (2016), doi:10.5670/oceanog.2016.66",
      "usage": "",
      "index": 0,
      "license": "cmocean by Kristen Thyng (MIT; https://github.com/matplotlib/cmocean)",
      "preview": "linear-gradient(90deg, rgb(4,35,51) 0%, rgb(13,49,101) 9%, rgb(53,51,156) 18%, rgb(95,63,153) 27%, rgb(126,78,144) 36%, rgb(159,90,136) 45%, rgb(193,100,122) 55%, rgb(225,114,98) 64%, rgb(246,138,71) 73%, rgb(252,174,60) 82%, rgb(246,211,71) 91%, rgb(232,250,91) 100%)"
    },
    {
      "name": "haline",
      "source": "cmocean",
      "source_id": "haline",
      "type": "sequential",
      "perceptually_uniform": true,
      "description": "Deep blue→pale yellow; oceanographic salinity but a usable general sequential.",
      "citation": "Thyng et al. (2016), doi:10.5670/oceanog.2016.66",
      "usage": "",
      "index": 1,
      "license": "cmocean by Kristen Thyng (MIT; https://github.com/matplotlib/cmocean)",
      "preview": "linear-gradient(90deg, rgb(42,24,108) 0%, rgb(43,36,160) 9%, rgb(16,72,153) 18%, rgb(20,97,142) 27%, rgb(38,117,138) 36%, rgb(53,137,136) 45%, rgb(66,157,133) 55%, rgb(81,178,125) 64%, rgb(110,198,109) 73%, rgb(160,214,92) 82%, rgb(212,225,112) 91%, rgb(253,239,154) 100%)"
    },
    {
      "name": "ice",
      "source": "cmocean",
      "source_id": "ice",
      "type": "sequential",
      "perceptually_uniform": true,
      "description": "Dark blue→white. Reads as 'cold magnitude' or 'depth'.",
      "citation": "Thyng et al. (2016), doi:10.5670/oceanog.2016.66",
      "usage": "",
      "index": 2,
      "license": "cmocean by Kristen Thyng (MIT; https://github.com/matplotlib/cmocean)",
      "preview": "linear-gradient(90deg, rgb(4,6,19) 0%, rgb(25,25,52) 9%, rgb(44,43,87) 18%, rgb(59,62,127) 27%, rgb(63,84,160) 36%, rgb(63,110,178) 45%, rgb(72,135,188) 55%, rgb(90,159,196) 64%, rgb(114,184,206) 73%, rgb(149,208,216) 82%, rgb(192,230,232) 91%, rgb(234,253,253) 100%)"
    },
    {
      "name": "amp",
      "source": "cmocean",
      "source_id": "amp",
      "type": "sequential",
      "perceptually_uniform": true,
      "description": "White→deep red. Single-tail amplitude; reads as 'intensity from baseline'.",
      "citation": "Thyng et al. (2016), doi:10.5670/oceanog.2016.66",
      "usage": "",
      "index": 3,
      "license": "cmocean by Kristen Thyng (MIT; https://github.com/matplotlib/cmocean)",
      "preview": "linear-gradient(90deg, rgb(241,237,236) 0%, rgb(230,210,204) 9%, rgb(221,183,171) 18%, rgb(213,156,136) 27%, rgb(205,129,104) 36%, rgb(197,103,73) 45%, rgb(187,74,48) 55%, rgb(173,44,36) 64%, rgb(151,20,40) 73%, rgb(120,14,40) 82%, rgb(90,14,31) 91%, rgb(60,9,18) 100%)"
    },
    {
      "name": "balance",
      "source": "cmocean",
      "source_id": "balance",
      "type": "diverging",
      "perceptually_uniform": true,
      "description": "Perceptually-uniform diverging blue→white→red. Anomalies around zero.",
      "citation": "Thyng et al. (2016), doi:10.5670/oceanog.2016.66",
      "usage": "",
      "index": 4,
      "license": "cmocean by Kristen Thyng (MIT; https://github.com/matplotlib/cmocean)",
      "preview": "linear-gradient(90deg, rgb(24,28,67) 0%, rgb(41,59,143) 9%, rgb(11,102,189) 18%, rgb(72,146,186) 27%, rgb(142,181,195) 36%, rgb(211,217,220) 45%, rgb(230,210,205) 55%, rgb(214,157,138) 64%, rgb(197,104,75) 73%, rgb(172,43,36) 82%, rgb(120,14,40) 91%, rgb(60,9,18) 100%)"
    },
    {
      "name": "delta",
      "source": "cmocean",
      "source_id": "delta",
      "type": "diverging",
      "perceptually_uniform": true,
      "description": "PU diverging with a clear white center; emphasizes near-zero values.",
      "citation": "Thyng et al. (2016), doi:10.5670/oceanog.2016.66",
      "usage": "",
      "index": 5,
      "license": "cmocean by Kristen Thyng (MIT; https://github.com/matplotlib/cmocean)",
      "preview": "linear-gradient(90deg, rgb(17,32,64) 0%, rgb(38,62,145) 9%, rgb(30,110,161) 18%, rgb(62,156,172) 27%, rgb(140,193,186) 36%, rgb(218,230,218) 45%, rgb(240,226,157) 55%, rgb(195,183,60) 64%, rgb(119,154,6) 73%, rgb(34,121,37) 82%, rgb(18,79,43) 91%, rgb(23,35,19) 100%)"
    },
    {
      "name": "curl",
      "source": "cmocean",
      "source_id": "curl",
      "type": "diverging",
      "perceptually_uniform": true,
      "description": "Magenta↔cyan PU diverging. Suited to vortices / curl-style fields.",
      "citation": "Thyng et al. (2016), doi:10.5670/oceanog.2016.66",
      "usage": "",
      "index": 6,
      "license": "cmocean by Kristen Thyng (MIT; https://github.com/matplotlib/cmocean)",
      "preview": "linear-gradient(90deg, rgb(21,29,68) 0%, rgb(28,73,94) 9%, rgb(18,116,118) 18%, rgb(68,158,130) 27%, rgb(154,190,157) 36%, rgb(224,225,211) 45%, rgb(241,218,207) 55%, rgb(225,161,137) 64%, rgb(204,104,100) 73%, rgb(164,55,96) 82%, rgb(112,24,92) 91%, rgb(52,13,53) 100%)"
    },
    {
      "name": "phase",
      "source": "cmocean",
      "source_id": "phase",
      "type": "cyclic",
      "perceptually_uniform": true,
      "description": "PU cyclic with higher chroma than twilight. Designed for oceanographic phase data.",
      "citation": "Thyng et al. (2016), doi:10.5670/oceanog.2016.66",
      "usage": "",
      "index": 7,
      "license": "cmocean by Kristen Thyng (MIT; https://github.com/matplotlib/cmocean)",
      "preview": "linear-gradient(90deg, rgb(168,120,13) 0%, rgb(198,96,51) 9%, rgb(217,67,97) 18%, rgb(221,38,166) 27%, rgb(197,60,225) 36%, rgb(154,98,244) 45%, rgb(96,128,228) 55%, rgb(40,145,184) 64%, rgb(17,151,138) 73%, rgb(39,154,79) 82%, rgb(119,141,18) 91%, rgb(168,120,13) 100%)"
    },
    {
      "name": "algae",
      "source": "cmocean",
      "source_id": "algae",
      "type": "sequential",
      "perceptually_uniform": true,
      "description": "White → deep green. Monochromatic green PU sequential; fills the green-hue gap among single-hue scientific maps.",
      "citation": "Thyng et al. (2016), doi:10.5670/oceanog.2016.66",
      "usage": "",
      "index": 8,
      "license": "cmocean by Kristen Thyng (MIT; https://github.com/matplotlib/cmocean)",
      "preview": "linear-gradient(90deg, rgb(215,249,208) 0%, rgb(186,228,175) 9%, rgb(157,209,144) 18%, rgb(123,191,115) 27%, rgb(86,175,92) 36%, rgb(38,158,81) 45%, rgb(8,138,78) 55%, rgb(14,117,72) 64%, rgb(23,97,62) 73%, rgb(26,76,50) 82%, rgb(24,56,36) 91%, rgb(18,36,20) 100%)"
    },
    {
      "name": "matter",
      "source": "cmocean",
      "source_id": "matter",
      "type": "sequential",
      "perceptually_uniform": true,
      "description": "White → magenta/red-purple. Monochromatic pink/magenta PU sequential; useful where green/blue palettes are reserved for other channels.",
      "citation": "Thyng et al. (2016), doi:10.5670/oceanog.2016.66",
      "usage": "",
      "index": 9,
      "license": "cmocean by Kristen Thyng (MIT; https://github.com/matplotlib/cmocean)",
      "preview": "linear-gradient(90deg, rgb(254,237,176) 0%, rgb(250,205,146) 9%, rgb(246,174,120) 18%, rgb(240,141,98) 27%, rgb(231,110,85) 36%, rgb(217,80,83) 45%, rgb(195,57,90) 55%, rgb(169,40,97) 64%, rgb(140,30,99) 73%, rgb(107,25,94) 82%, rgb(77,21,81) 91%, rgb(47,15,62) 100%)"
    },
    {
      "name": "tempo",
      "source": "cmocean",
      "source_id": "tempo",
      "type": "sequential",
      "perceptually_uniform": true,
      "description": "White → teal. Monochromatic cyan-teal PU sequential; cooler/cleaner than ice when high-chroma blues clash.",
      "citation": "Thyng et al. (2016), doi:10.5670/oceanog.2016.66",
      "usage": "",
      "index": 10,
      "license": "cmocean by Kristen Thyng (MIT; https://github.com/matplotlib/cmocean)",
      "preview": "linear-gradient(90deg, rgb(255,246,244) 0%, rgb(223,225,211) 9%, rgb(189,206,181) 18%, rgb(151,189,156) 27%, rgb(111,173,139) 36%, rgb(65,157,130) 45%, rgb(26,138,125) 55%, rgb(18,117,118) 64%, rgb(26,95,107) 73%, rgb(28,73,94) 82%, rgb(26,52,80) 91%, rgb(21,29,68) 100%)"
    },
    {
      "name": "turbid",
      "source": "cmocean",
      "source_id": "turbid",
      "type": "sequential",
      "perceptually_uniform": true,
      "description": "White → brown/tan. Monochromatic earth-tone PU sequential; reads as 'sediment' or 'turbidity magnitude'.",
      "citation": "Thyng et al. (2016), doi:10.5670/oceanog.2016.66",
      "usage": "",
      "index": 11,
      "license": "cmocean by Kristen Thyng (MIT; https://github.com/matplotlib/cmocean)",
      "preview": "linear-gradient(90deg, rgb(233,246,171) 0%, rgb(220,219,138) 9%, rgb(210,193,108) 18%, rgb(199,167,82) 27%, rgb(187,143,67) 36%, rgb(171,122,60) 45%, rgb(151,104,58) 55%, rgb(129,88,57) 64%, rgb(106,73,53) 73%, rgb(81,59,47) 82%, rgb(57,45,38) 91%, rgb(34,31,27) 100%)"
    }
  ]
}
