{
  "version": 2,
  "library": "matplotlib",
  "width": 256,
  "rows": 12,
  "colormaps": [
    {
      "name": "viridis",
      "source": "matplotlib",
      "source_id": "viridis",
      "type": "sequential",
      "perceptually_uniform": true,
      "description": "Default perceptually-uniform sequential. Safe baseline for scalar fields.",
      "citation": "Smith & van der Walt (2015), 'A Better Default Colormap for Matplotlib', SciPy talk",
      "usage": "",
      "index": 0,
      "license": "matplotlib (BSD-style; https://matplotlib.org/stable/users/project/license.html)",
      "preview": "linear-gradient(90deg, rgb(68,1,84) 0%, rgb(72,33,115) 9%, rgb(67,62,133) 18%, rgb(56,89,140) 27%, rgb(45,112,142) 36%, rgb(37,133,142) 45%, rgb(30,155,138) 55%, rgb(42,176,127) 64%, rgb(80,196,106) 73%, rgb(134,213,73) 82%, rgb(194,223,35) 91%, rgb(253,231,37) 100%)"
    },
    {
      "name": "magma",
      "source": "matplotlib",
      "source_id": "magma",
      "type": "sequential",
      "perceptually_uniform": true,
      "description": "Dark→bright with warm hues. Higher chroma than viridis.",
      "citation": "Smith & van der Walt (2015), 'A Better Default Colormap for Matplotlib', SciPy talk",
      "usage": "",
      "index": 1,
      "license": "matplotlib (BSD-style; https://matplotlib.org/stable/users/project/license.html)",
      "preview": "linear-gradient(90deg, rgb(0,0,4) 0%, rgb(18,13,49) 9%, rgb(51,16,103) 18%, rgb(90,22,126) 27%, rgb(126,36,130) 36%, rgb(163,48,126) 45%, rgb(200,62,115) 55%, rgb(233,84,98) 64%, rgb(249,123,93) 73%, rgb(254,169,115) 82%, rgb(254,211,149) 91%, rgb(252,253,191) 100%)"
    },
    {
      "name": "plasma",
      "source": "matplotlib",
      "source_id": "plasma",
      "type": "sequential",
      "perceptually_uniform": true,
      "description": "Purple→yellow ramp; high chroma across the range.",
      "citation": "Smith & van der Walt (2015), 'A Better Default Colormap for Matplotlib', SciPy talk",
      "usage": "",
      "index": 2,
      "license": "matplotlib (BSD-style; https://matplotlib.org/stable/users/project/license.html)",
      "preview": "linear-gradient(90deg, rgb(13,8,135) 0%, rgb(62,4,156) 9%, rgb(99,0,167) 18%, rgb(135,7,166) 27%, rgb(166,32,152) 36%, rgb(192,58,131) 45%, rgb(213,84,110) 55%, rgb(231,111,90) 64%, rgb(245,140,70) 73%, rgb(253,174,50) 82%, rgb(252,210,37) 91%, rgb(240,249,33) 100%)"
    },
    {
      "name": "inferno",
      "source": "matplotlib",
      "source_id": "inferno",
      "type": "sequential",
      "perceptually_uniform": true,
      "description": "Most aggressive luminance ramp; black→bright yellow through red.",
      "citation": "Smith & van der Walt (2015), 'A Better Default Colormap for Matplotlib', SciPy talk",
      "usage": "",
      "index": 3,
      "license": "matplotlib (BSD-style; https://matplotlib.org/stable/users/project/license.html)",
      "preview": "linear-gradient(90deg, rgb(0,0,4) 0%, rgb(20,11,52) 9%, rgb(57,9,99) 18%, rgb(97,19,110) 27%, rgb(133,33,107) 36%, rgb(169,46,94) 45%, rgb(203,65,73) 55%, rgb(230,93,47) 64%, rgb(247,130,18) 73%, rgb(252,174,18) 82%, rgb(245,219,76) 91%, rgb(252,255,164) 100%)"
    },
    {
      "name": "cividis",
      "source": "matplotlib",
      "source_id": "cividis",
      "type": "sequential",
      "perceptually_uniform": true,
      "description": "Color-vision-deficiency safe alternative to viridis.",
      "citation": "Nuñez, Anderton & Renslow (2018), 'Optimizing colormaps with consideration for color vision deficiency to enable accurate interpretation of scientific data', PLOS ONE, doi:10.1371/journal.pone.0199239",
      "usage": "",
      "index": 4,
      "license": "matplotlib (BSD-style; https://matplotlib.org/stable/users/project/license.html)",
      "preview": "linear-gradient(90deg, rgb(0,34,78) 0%, rgb(1,50,113) 9%, rgb(47,66,109) 18%, rgb(73,83,108) 27%, rgb(94,99,111) 36%, rgb(114,115,116) 45%, rgb(135,132,120) 55%, rgb(157,149,118) 64%, rgb(181,168,111) 73%, rgb(206,188,99) 82%, rgb(231,209,80) 91%, rgb(254,232,56) 100%)"
    },
    {
      "name": "turbo",
      "source": "matplotlib",
      "source_id": "turbo",
      "type": "sequential",
      "perceptually_uniform": false,
      "description": "High-contrast rainbow alternative to jet. Not perceptually uniform; use when discriminating bands matters more than ordering.",
      "citation": "Mikhailov (2019), 'Turbo, An Improved Rainbow Colormap for Visualization', Google AI Blog",
      "usage": "",
      "index": 5,
      "license": "matplotlib (BSD-style; https://matplotlib.org/stable/users/project/license.html)",
      "preview": "linear-gradient(90deg, rgb(48,18,59) 0%, rgb(68,84,195) 9%, rgb(68,143,254) 18%, rgb(31,201,221) 27%, rgb(42,239,161) 36%, rgb(125,255,86) 45%, rgb(193,243,52) 55%, rgb(241,203,58) 64%, rgb(254,147,42) 73%, rgb(234,78,13) 82%, rgb(190,33,2) 91%, rgb(122,4,3) 100%)"
    },
    {
      "name": "coolwarm",
      "source": "matplotlib",
      "source_id": "coolwarm",
      "type": "diverging",
      "perceptually_uniform": true,
      "description": "Moreland's smooth diverging. Recommended default for signed anomaly fields.",
      "citation": "Moreland (2009), 'Diverging Color Maps for Scientific Visualization', Proc. ISVC",
      "usage": "",
      "index": 6,
      "license": "matplotlib (BSD-style; https://matplotlib.org/stable/users/project/license.html)",
      "preview": "linear-gradient(90deg, rgb(59,76,192) 0%, rgb(86,115,224) 9%, rgb(117,151,246) 18%, rgb(150,183,255) 27%, rgb(181,205,250) 36%, rgb(209,218,233) 45%, rgb(232,214,204) 55%, rgb(245,193,169) 64%, rgb(246,163,133) 73%, rgb(234,123,96) 82%, rgb(212,78,65) 91%, rgb(180,4,38) 100%)"
    },
    {
      "name": "RdBu_r",
      "source": "matplotlib",
      "source_id": "RdBu_r",
      "type": "diverging",
      "perceptually_uniform": false,
      "description": "Red-positive / blue-negative. Common neuroscience activation convention.",
      "citation": "Brewer, ColorBrewer 2.0 (RdBu, reversed); https://colorbrewer2.org",
      "usage": "",
      "index": 7,
      "license": "matplotlib (BSD-style; https://matplotlib.org/stable/users/project/license.html)",
      "preview": "linear-gradient(90deg, rgb(5,48,97) 0%, rgb(30,97,165) 9%, rgb(60,138,190) 18%, rgb(126,184,215) 27%, rgb(187,218,234) 36%, rgb(230,239,244) 45%, rgb(250,234,225) 55%, rgb(250,200,175) 64%, rgb(236,147,116) 73%, rgb(207,82,70) 82%, rgb(171,22,42) 91%, rgb(103,0,31) 100%)"
    },
    {
      "name": "BrBG",
      "source": "matplotlib",
      "source_id": "BrBG",
      "type": "diverging",
      "perceptually_uniform": false,
      "description": "Brown↔teal terrain-style diverging. Useful when red/blue clashes with overlay colors.",
      "citation": "Brewer, ColorBrewer 2.0; https://colorbrewer2.org",
      "usage": "",
      "index": 8,
      "license": "matplotlib (BSD-style; https://matplotlib.org/stable/users/project/license.html)",
      "preview": "linear-gradient(90deg, rgb(84,48,5) 0%, rgb(135,78,10) 9%, rgb(181,120,38) 18%, rgb(215,177,105) 27%, rgb(238,219,170) 36%, rgb(245,239,222) 45%, rgb(224,240,238) 55%, rgb(174,224,216) 64%, rgb(109,191,180) 73%, rgb(43,141,133) 82%, rgb(1,98,89) 91%, rgb(0,60,48) 100%)"
    },
    {
      "name": "twilight",
      "source": "matplotlib",
      "source_id": "twilight",
      "type": "cyclic",
      "perceptually_uniform": true,
      "description": "Perceptually-uniform cyclic; first and last colors match. Use for phase / orientation.",
      "citation": "van der Walt (matplotlib core team), contributed for matplotlib 3.0",
      "usage": "",
      "index": 9,
      "license": "matplotlib (BSD-style; https://matplotlib.org/stable/users/project/license.html)",
      "preview": "linear-gradient(90deg, rgb(226,217,226) 0%, rgb(173,195,205) 9%, rgb(117,154,193) 18%, rgb(96,103,182) 27%, rgb(91,48,149) 36%, rgb(61,17,78) 45%, rgb(65,18,61) 55%, rgb(123,33,80) 64%, rgb(169,73,80) 73%, rgb(196,129,102) 82%, rgb(210,184,167) 91%, rgb(226,217,226) 100%)"
    },
    {
      "name": "tab10",
      "source": "matplotlib",
      "source_id": "tab10",
      "type": "categorical",
      "perceptually_uniform": false,
      "description": "10 distinct categorical colors. Sampled to 256 produces banded output (banding is the point).",
      "citation": "Tableau categorical palette (D3-style); see matplotlib._cm_listed",
      "usage": "",
      "index": 10,
      "license": "matplotlib (BSD-style; https://matplotlib.org/stable/users/project/license.html)",
      "preview": "linear-gradient(90deg, rgb(31,119,180) 0%, rgb(31,119,180) 9%, rgb(255,127,14) 18%, rgb(44,160,44) 27%, rgb(214,39,40) 36%, rgb(148,103,189) 45%, rgb(140,86,75) 55%, rgb(227,119,194) 64%, rgb(127,127,127) 73%, rgb(188,189,34) 82%, rgb(23,190,207) 91%, rgb(23,190,207) 100%)"
    },
    {
      "name": "Set2",
      "source": "matplotlib",
      "source_id": "Set2",
      "type": "categorical",
      "perceptually_uniform": false,
      "description": "8 softer pastel categories. Lower contrast than tab10; good for dense legends.",
      "citation": "Brewer, ColorBrewer 2.0 (Set2 qualitative); https://colorbrewer2.org",
      "usage": "",
      "index": 11,
      "license": "matplotlib (BSD-style; https://matplotlib.org/stable/users/project/license.html)",
      "preview": "linear-gradient(90deg, rgb(102,194,165) 0%, rgb(102,194,165) 9%, rgb(252,141,98) 18%, rgb(141,160,203) 27%, rgb(141,160,203) 36%, rgb(231,138,195) 45%, rgb(166,216,84) 55%, rgb(255,217,47) 64%, rgb(255,217,47) 73%, rgb(229,196,148) 82%, rgb(179,179,179) 91%, rgb(179,179,179) 100%)"
    }
  ]
}
